{
  "evaluation_id": "dcas-eval-example-agent-beta-001",
  "subject_ref": {
    "subject_id": "did:web:example.invalid:agents:beta",
    "publication_profile_uri": "https://example.invalid/oasf/profile/example-agent-beta.json",
    "declaration_uri": "https://example.invalid/anab/example.agent.beta/conformance.json"
  },
  "evaluator": {
    "name": "Example DCAS Evaluator",
    "engine": "dcas",
    "run_uri": "https://example.invalid/evaluations/agent-beta/001",
    "generated_at": "2026-03-25T00:00:00Z"
  },
  "result": {
    "status": "pass",
    "summary": "The subject satisfied mapped controls and published evidence discoverable through the canonical artifact layer."
  },
  "assurance": {
    "assurance_level": "AL3",
    "controls_checked": [
      "OASF-PUB-01",
      "OASF-EVID-01",
      "ANAGB-AUTH-01"
    ],
    "control_mapping_ref": "https://example.invalid/oasf/mappings/oasf-control-crosswalk.json"
  },
  "evidence": {
    "bundle_uri": "https://example.invalid/anab/example.agent.beta/evidence.json",
    "artifacts": [
      "https://example.invalid/anab/example.agent.beta/evidence.json"
    ],
    "sha256": "3333333333333333333333333333333333333333333333333333333333333333"
  },
  "authority_boundary": {
    "statement": "This evaluation result attests to conformance and evidence sufficiency for the declared scope. It does not grant runtime authority outside that scope.",
    "authoritative_party": "Example DCAS Evaluator",
    "delegation_required": true,
    "scope": [
      "evaluation",
      "assurance"
    ]
  },
  "semantic_bindings": [
    {
      "model": "TSMM",
      "entity_id": "TSMM-ENT-AGENT",
      "binding_uri": "https://example.invalid/tsmm/bindings/agent-beta.json"
    }
  ]
}
